file_name,local_path,title,description,tags
image_0.png,image_0.png,Mystic Ink: Chinese Abstract Acrylic Wall Art Panels,"Get lost in the mesmerizing beauty of Chinese Abstract with this unique T-shirt, blending traditional elements with modern minimalism.
    <p>Acrylic art panels are a modern way to display beautiful and vibrant art that looks like it's embedded in clear glass. They have a clear, glossy acrylic surface and a white vinyl backing. Four silver stand-offs make it very easy to mount to the wall. Make your own original designs and print them on any (or all) of the seven available panel sizes in horizontal and vertical orientations. Square dimensions are available.</p>
<p>.: Material: Clear acrylic with white vinyl backing<br />.: Clear, glossy surface<br />.: Seven sizes to choose from<br />.: Horizontal, vertical and square options available<br />.: NB! For indoor use only</p>
    ","Chinese Abstract, Chinese art, abstract design, contemporary, cultural fusion, traditional meets modern, Eastern aesthetics, Asian inspiration, minimalist, vibrant colors, symbolic motifs, art fashion"
image_1.png,image_1.png,Smile On: Happy Vibes Acrylic Wall Art Panels,"Spread happiness with our Smiley Face T-shirt! This fun and vibrant design will brighten any day and bring a contagious smile to everyone you meet.
    <p>Acrylic art panels are a modern way to display beautiful and vibrant art that looks like it's embedded in clear glass. They have a clear, glossy acrylic surface and a white vinyl backing. Four silver stand-offs make it very easy to mount to the wall. Make your own original designs and print them on any (or all) of the seven available panel sizes in horizontal and vertical orientations. Square dimensions are available.</p>
<p>.: Material: Clear acrylic with white vinyl backing<br />.: Clear, glossy surface<br />.: Seven sizes to choose from<br />.: Horizontal, vertical and square options available<br />.: NB! For indoor use only</p>
    ","smiley face, happy, positive, emotions, cheerful, good vibes, happiness, positivity, smile, cute, fun, lighthearted, joy, laughter, optimistic, cheerful clothing, trendy"
